{
  "schema_version": "geo.baseline_report.v1",
  "run": {
    "id": "geo-0.1-live",
    "mode": "live",
    "generated_at": "2026-07-03T17:54:21.955Z"
  },
  "source_truth_version": "geo-0.1",
  "endpoint_registry_version": "geo-0.1",
  "validator_version": "geo-0.1.0",
  "environment": {
    "node": "v25.6.1",
    "platform": "darwin",
    "arch": "arm64",
    "hostname_hash": "90e339db27ad59a1"
  },
  "request_count": 6,
  "fetch_outcomes": [
    {
      "endpoint_key": "home_camilocarlone",
      "requested_url": "https://camilocarlone.com/",
      "final_url": "https://camilocarlone.com/",
      "redirect_chain": [],
      "observed_at": "2026-07-03T17:52:26.489Z",
      "status": 200,
      "content_type": "text/html; charset=utf-8",
      "byte_count": 17200,
      "raw_sha256": "29cf327a77fd05778b7caa8efd38c4cfdb182877c98733bc0a305b1734ce82ac",
      "normalized_sha256": "24bd20200c064ec236dfb2f1ea6c2ff4931e1a63c8f79d122f9fa8f947765373",
      "failure": null
    },
    {
      "endpoint_key": "taa_publication_page",
      "requested_url": "https://camilocarlone.com/the-apologetic-authority/",
      "final_url": "https://camilocarlone.com/the-apologetic-authority/",
      "redirect_chain": [],
      "observed_at": "2026-07-03T17:52:26.757Z",
      "status": 200,
      "content_type": "text/html; charset=utf-8",
      "byte_count": 145025,
      "raw_sha256": "8ee65ce9c0b1e858cd02b4f55c050f7cabe8a766d28ca81dbd961400e61d3536",
      "normalized_sha256": "317eb5308c1506c83e46f34f1587b0e91e85dd211af28be43ab8f4eb7c5e8b23",
      "failure": null
    },
    {
      "endpoint_key": "aetherus_pages",
      "requested_url": "https://aetherus-monolith.pages.dev/",
      "final_url": "https://aetherus-monolith.pages.dev/",
      "redirect_chain": [],
      "observed_at": "2026-07-03T17:52:26.901Z",
      "status": 200,
      "content_type": "text/html; charset=utf-8",
      "byte_count": 17200,
      "raw_sha256": "29cf327a77fd05778b7caa8efd38c4cfdb182877c98733bc0a305b1734ce82ac",
      "normalized_sha256": "24bd20200c064ec236dfb2f1ea6c2ff4931e1a63c8f79d122f9fa8f947765373",
      "failure": null
    },
    {
      "endpoint_key": "taa_zenodo_doi",
      "requested_url": "https://doi.org/10.5281/zenodo.20788207",
      "final_url": "https://zenodo.org/records/20788207",
      "redirect_chain": [
        {
          "from": "https://doi.org/10.5281/zenodo.20788207",
          "to": "https://zenodo.org/doi/10.5281/zenodo.20788207",
          "status": 302
        },
        {
          "from": "https://zenodo.org/doi/10.5281/zenodo.20788207",
          "to": "https://zenodo.org/records/20788207",
          "status": 302
        }
      ],
      "observed_at": "2026-07-03T17:52:27.080Z",
      "status": 200,
      "content_type": "text/html; charset=utf-8",
      "byte_count": 78875,
      "raw_sha256": "14d61ea3230f5d0545653412adc9e8540a7f8bad4c16ab322fa26606a13617e0",
      "normalized_sha256": "ecd4749ca93e69cdc3e37be13639410c70cdad8ee65a6006439cce4b512e5cb4",
      "failure": null
    },
    {
      "endpoint_key": "aetherus_github_org",
      "requested_url": "https://github.com/AETHERUS-MONOLITH",
      "final_url": "https://github.com/AETHERUS-MONOLITH",
      "redirect_chain": [],
      "observed_at": "2026-07-03T17:52:27.981Z",
      "status": 200,
      "content_type": "text/html; charset=utf-8",
      "byte_count": 193407,
      "raw_sha256": "3ae2bd048477a7667d719cbbf45684822c356445657d951cea6b3f810be6def4",
      "normalized_sha256": "94fb695a6c667919d5b4fed115b0026f7441a5644571f2c4fb0ff3b25295918b",
      "failure": null
    },
    {
      "endpoint_key": "lesswrong_camilo_profile",
      "requested_url": "https://www.lesswrong.com/users/camilocarlone",
      "final_url": "https://www.lesswrong.com/users/camilocarlone",
      "redirect_chain": [],
      "observed_at": "2026-07-03T17:52:28.405Z",
      "status": 200,
      "content_type": "text/html; charset=utf-8",
      "byte_count": 229790,
      "raw_sha256": "8f1c22a770da47938fbe4a33e18b6620616cdaa32debd43b34c338a9df8fab24",
      "normalized_sha256": "587b3e2ccec718b40d8aef6c2095552476b3607f7242e63ea5cfce569490989d",
      "failure": null
    }
  ],
  "findings": {
    "identity": [
      {
        "id": "geo-identity-source-truth-pass",
        "category": "identity",
        "endpoint_key": null,
        "entity_keys": [
          "entity:camilo_carlone",
          "entity:aetherus",
          "entity:the_apologetic_authority"
        ],
        "status": "pass",
        "severity": "info",
        "message": "Source-truth identity invariants are valid.",
        "evidence": {
          "checked_invariants": 8
        },
        "reproducibility": {
          "analysis_version": "geo.identity.v1",
          "deterministic": true
        },
        "validator_version": "geo-0.1.0"
      }
    ],
    "endpoint_availability": [
      {
        "id": "geo-endpoint-aetherus_github_org",
        "category": "endpoint_availability",
        "endpoint_key": "aetherus_github_org",
        "entity_keys": [
          "entity:aetherus"
        ],
        "status": "pass",
        "severity": "info",
        "message": "Endpoint responded within configured availability boundaries.",
        "evidence": {
          "requested_url": "https://github.com/AETHERUS-MONOLITH",
          "final_url": "https://github.com/AETHERUS-MONOLITH",
          "redirect_chain": [],
          "status": 200,
          "content_type": "text/html; charset=utf-8",
          "byte_count": 193407,
          "failure": null,
          "expected_content_class": "html"
        },
        "reproducibility": {
          "analysis_version": "geo.endpoint_availability.v1",
          "deterministic": true
        },
        "validator_version": "geo-0.1.0"
      },
      {
        "id": "geo-endpoint-aetherus_pages",
        "category": "endpoint_availability",
        "endpoint_key": "aetherus_pages",
        "entity_keys": [
          "entity:aetherus"
        ],
        "status": "pass",
        "severity": "info",
        "message": "Endpoint responded within configured availability boundaries.",
        "evidence": {
          "requested_url": "https://aetherus-monolith.pages.dev/",
          "final_url": "https://aetherus-monolith.pages.dev/",
          "redirect_chain": [],
          "status": 200,
          "content_type": "text/html; charset=utf-8",
          "byte_count": 17200,
          "failure": null,
          "expected_content_class": "html"
        },
        "reproducibility": {
          "analysis_version": "geo.endpoint_availability.v1",
          "deterministic": true
        },
        "validator_version": "geo-0.1.0"
      },
      {
        "id": "geo-endpoint-home_camilocarlone",
        "category": "endpoint_availability",
        "endpoint_key": "home_camilocarlone",
        "entity_keys": [
          "entity:aetherus"
        ],
        "status": "pass",
        "severity": "info",
        "message": "Endpoint responded within configured availability boundaries.",
        "evidence": {
          "requested_url": "https://camilocarlone.com/",
          "final_url": "https://camilocarlone.com/",
          "redirect_chain": [],
          "status": 200,
          "content_type": "text/html; charset=utf-8",
          "byte_count": 17200,
          "failure": null,
          "expected_content_class": "html"
        },
        "reproducibility": {
          "analysis_version": "geo.endpoint_availability.v1",
          "deterministic": true
        },
        "validator_version": "geo-0.1.0"
      },
      {
        "id": "geo-endpoint-lesswrong_camilo_profile",
        "category": "endpoint_availability",
        "endpoint_key": "lesswrong_camilo_profile",
        "entity_keys": [
          "entity:camilo_carlone"
        ],
        "status": "pass",
        "severity": "info",
        "message": "Endpoint responded within configured availability boundaries.",
        "evidence": {
          "requested_url": "https://www.lesswrong.com/users/camilocarlone",
          "final_url": "https://www.lesswrong.com/users/camilocarlone",
          "redirect_chain": [],
          "status": 200,
          "content_type": "text/html; charset=utf-8",
          "byte_count": 229790,
          "failure": null,
          "expected_content_class": "html"
        },
        "reproducibility": {
          "analysis_version": "geo.endpoint_availability.v1",
          "deterministic": true
        },
        "validator_version": "geo-0.1.0"
      },
      {
        "id": "geo-endpoint-taa_publication_page",
        "category": "endpoint_availability",
        "endpoint_key": "taa_publication_page",
        "entity_keys": [
          "entity:the_apologetic_authority",
          "entity:camilo_carlone"
        ],
        "status": "pass",
        "severity": "info",
        "message": "Endpoint responded within configured availability boundaries.",
        "evidence": {
          "requested_url": "https://camilocarlone.com/the-apologetic-authority/",
          "final_url": "https://camilocarlone.com/the-apologetic-authority/",
          "redirect_chain": [],
          "status": 200,
          "content_type": "text/html; charset=utf-8",
          "byte_count": 145025,
          "failure": null,
          "expected_content_class": "html"
        },
        "reproducibility": {
          "analysis_version": "geo.endpoint_availability.v1",
          "deterministic": true
        },
        "validator_version": "geo-0.1.0"
      },
      {
        "id": "geo-endpoint-taa_zenodo_doi",
        "category": "endpoint_availability",
        "endpoint_key": "taa_zenodo_doi",
        "entity_keys": [
          "entity:the_apologetic_authority"
        ],
        "status": "pass",
        "severity": "info",
        "message": "Endpoint responded within configured availability boundaries.",
        "evidence": {
          "requested_url": "https://doi.org/10.5281/zenodo.20788207",